Channel Name,Title,Description,Political Affiliation
The Young Turks,WATCH: Mitch McConnell&#39;s Presser Health Scare And The Donor Problem,Senate Minority Leader Mitch McConnel appeared to have a neurological episode during a presser. Cenk Uygur and Ana ...,Left
The Young Turks,Sorority Consultant&#39;s Former Client Accidentally Proves It&#39;s A Scam,Sorority Consultant's Former Client Accidentally Proves It's A Scam #Shorts #TYT #News #Government #Politics #Progressives ...,Left
The Young Turks,Congressional Progressives Make A Move...Is It For Real?,"Reps. Barbara Lee, Summer Lee, Rashida Tlaib, and Jamaal Bowman introduce the Oppose Limitless Inequality Growth and ...",Left
The Young Turks,DeSantis&#39; Board Is DEFUNDING Disney World&#39;s Police,"The board, appointed by Florida Gov. Ron DeSantis, decided to slash an $8 million in police funding for the popular travel ...",Left
The Young Turks,Trump Indictment IMMINENT For Alleged 2020 Election Interference,Trump attorneys Todd Blanche and John Lauro met with prosecutors to discuss charges potential interference in the 2020 election ...,Left
The Young Turks,WATCH: Netanyahu Makes BOGUS Claims About Judicial Overhaul,Israeli Prime Minister Benjamin Netanyahu called the judicial system overhaul that essentially strips away checks and balances to ...,Left
The Young Turks,Joe Manchin LEAKS Connections to DARK MONEY,Proof Senator Joe Manchin is a grifter who only cares about donations from big corporations. Watch TYT LIVE on weekdays 6-8 ...,Left
The Young Turks,Lizzo Teaches Young Fan How To Quiet The Haters,Lizzo helped a young fan in Sydney regain her confidence in the most spectacular way. Ana Kasparian and John Iadarola discuss ...,Left
The Young Turks,"With Ocean Temps At  Hot Tub Levels, The World Is On The BRINK",South Florida ocean water temps are as hot as a hot tub. Ana Kasparian and John Iadarola discuss on The Young Turks.,Left
The Young Turks,Whistleblower: The U.S. Has NON-HUMAN Remains Of UFOs,"David Grusch, a veteran intelligence officer, claimed that the federal government has non-human remains of UAPs in a House ...",Left
The Young Turks,Elon Musk Has No Plan After Torching Twitter&#39;s Value With &#39;X&#39; Rebrand,Elon Musk Has No Plan After Torching Twitter's Value With 'X' Rebrand #Shorts #TYT #News #Government #Politics ...,Left
The Young Turks,Hunter Biden&#39;s Plea Deal Is REALLY Up In The Air,President Joe Biden's son Hunter Biden has run into a complicated situation with his court hearing on his alleged tax evasion and ...,Left
The Young Turks,Rudy CONFESSES He Lied About The 2020 Elections,Rudy Giuliani admitted during a defamation lawsuit to making false statements about elections workers in Georgia during the ...,Left
The Young Turks,The Very REAL Victims Of Retail Theft,CNN's Kyung Lah witnessed 3 incidents of theft while she was reporting on rampant shoplifting in San Francisco . Ana Kasparian ...,Left
The Young Turks,Mayor Stands Up For City After Being STIFFED By Trump Team,"Erie, PA Mayor Joe Schember says Trump's campaign still owes his city $35000 from a 2018 rally. Cenk Uygur and Ana ...",Left
The Young Turks,Murdochs Are CLAMORING For A DeSantis Replacement To Take On Trump,Fox News' Steve Doocy suggested that Virginia Gov. Glenn Youngkin is the guy for the job. Cenk Uygur and Ana Kasparian ...,Left
The Young Turks,PREDATOR Anti-Abortion Leader Arrested For Abusing Young Child,"Marty Decole “Cole” Wagner, chair of the Alliance for a Pro-Life Alabama, was arrested for sexual abuse of a child under ...",Left
The Young Turks,Report: PragerU&#39;s AWFUL Kids Propaganda Will Be Taught In Florida Schools,"Wealthy-donor funded right-wing group PragerU said they are offering ""supplemental curriculum"" to teachers. Cenk Uygur and ...",Left
The Young Turks,WATCH: Greg Gutfeld Makes HORRIFYING Assertion About Holocaust Victims,Fox News' Greg Gutfeld mischaracterized Viktor Frankl's book to push an insane anti-semitic point. Cenk Uygur and Ana ...,Left
The Young Turks,Biden Appointee Spent THOUSANDS on Hunter&#39;s Novice Art,"President Joe Biden appointed Elizabeth Hirsh Naftali, a significant Democratic donor and purchaser of Hunter Biden's art work, ...",Left
The Young Turks,"Abbott Vows To Continue Inhumane SPIKED Barricades, Defying DOJ",Texas Gov. Greg Abbott declared that he will continue utilizing the cruel tactic in the midst of a lawsuit by the DOJ. Cenk Uygur ...,Left
The Young Turks,Summer Lee Drops Truth Bomb &amp; Leaves DoD Rep Speechless,Summer Lee Drops Truth Bomb & Leaves DoD Rep Speechless #Shorts #TYT #News #Government #Politics #Progressives ...,Left
The Young Turks,VICTORY! Teamsters Secure Pay Raises For UPS Workers,"""UPS has put $30 billion in new money on the table as a direct result of these negotiations,"" Teamsters president Sean O'Brien ...",Left
The Young Turks,Trump&#39;s Financial Failures Have Reached Legendary Status,Trump's Financial Failures Have Reached Legendary Status #Shorts #TYT #News #Government #Politics #Progressives ...,Left
The Young Turks,Old School: About That Marjorie Taylor Greene Attack On TYT...,Is Marjorie Taylor Greene a member of TYT? John Iadarola discusses on The Young Turks.,Left
The Young Turks,Are Sharks Eating Cocaine?,Some experts are claiming sharks are exhibiting erratic behavior in the Florida Keys. Cenk Uygur and Ben Gleib discuss on The ...,Left
The Young Turks,"Elon Musk Rebrands Twitter As &#39;X,&#39; But Has He Thought It Through?","Elon Musk swiftly changed Twitter's logo to 'X' and the reactions are, let's say, mixed. Cenk Uygur and Ben Gleib discuss on The ...",Left
The Young Turks,"Republican Lawmaker Wears Pink Tutu For Charity, Gets Called A Groomer",Mississippi state Senator Jeremy England wore a pink tutu to raise money for breast cancer research. Cenk Uygur and Ben Gleib ...,Left
The Young Turks,"LA Cop BEATS Trans Man, Writes BONKERS Incident Report","Emmett Brock's lawyer called the violent cop a ""thin-skinned thug."" Cenk Uygur and Ben Gleib discuss on The Young Turks.",Left
The Young Turks,Marjorie Taylor Greene Attacks TYT Host! Watch the Counterattack!,,Left
The Young Turks,POLL: Trump Voters Think Racism Against THIS Group Is Most Prevalent,A new Yahoo News/YouGov poll show that Trump voters believe racism against white Americans are more prevalant than racism ...,Left
The Young Turks,WATCH: Nancy Pelosi GUSHES Over Biden&#39;s Economy,Nancy Pelosi assured CNN's Dana Bash that Biden's economic poll numbers are low because of messaging. Cenk Uygur and ...,Left
Khan Academy,Adding and subtracting fractions with negatives,Use the properties of addition to strategically add and subtract fractions with negatives and unlike denominators. We can rewrite ...,Non-political
Khan Academy,Equivalent expressions with negative numbers,Understand that we can commute and associate terms as long as we keep the signs with the terms. We can also apply the ...,Non-political
Khan Academy,Subtracting integers  find the missing value,Use number lines to find missing numbers in subtraction equations with integers. Arrows to the left equivalently mean adding a ...,Non-political
Khan Academy,Adding integers: find the missing value,"Use number lines to find missing addends in addition equations with integers. When we add a positive value, we move to the right ...",Non-political
Khan Academy,Adding the opposite with integer chips,Use integer chips to explore the conjecture that subtracting a number gives the same result as adding the opposite of the number.,Non-political
Khan Academy,Zero pairs worked example,"When we have a positive unit and a negative unit, they add up to zero. We call that a zero pair. Let's use integer chips to represent ...",Non-political
Khan Academy,Common percentages,Find common percentages of a number by taking a familiar fraction of the number.,Non-political
Khan Academy,Plotting inequalities on a number line,"Graph inequalities on a number line, using filled in points at the boundary for ≤ or ≥ and arrows in the appropriate direction.",Non-political
Khan Academy,Student navigation | Using course mastery on Khan Academy | Khan for Educators | Khan Academy,Learn how students navigate the mastery learning platform on Khan Academy. Learn more about Khan for Educators here: ...,Non-political
Khan Academy,Introduction to negative numbers,Keep going! Check out the next lesson and practice what you're learning: ...,Non-political
Khan Academy,Strong acid solutions | Acids and bases | AP Chemistry | Khan Academy,Keep going! Check out the next lesson and practice what you're learning: ...,Non-political
Khan Academy,Human impact on aquatic environments| AP Environmental science| Khan Academy,Keep going! Check out the next lesson and practice what you're learning: ...,Non-political
Khan Academy,Worked example: Measuring the energy content of foods using soda-can calorimetry | Khan Academy,"Calorimetry is often used to evaluate the energy content of different foods. In this video, we'll see how data from a soda can ...",Non-political
Khan Academy,Intro to determinant notation and computation | Matrices | Precalculus | Khan Academy,Keep going! Check out the next lesson and practice what you're learning: ...,Non-political
Khan Academy,Multistep reaction energy profiles | Kinetics | AP Chemistry | Khan Academy,Keep going! Check out the next lesson and practice what you're learning: ...,Non-political
Khan Academy,"Breakthrough Junior Challenge Winner Reveal! Homeroom with Sal - Thursday, December 3","And the winner is... Join us live for a special Homeroom with Sal and past winner, Hillary Andales as they reveal this year's ...",Non-political
Khan Academy,Worked example: Calculating the maximum wavelength capable of ionization | Khan Academy,Keep going! Check out the next lesson and practice what you're learning: ...,Non-political
Khan Academy,Identifying value in digits,Keep going! Check out the next lesson and practice what you're learning: ...,Non-political
Khan Academy,"Homeroom with Sal &amp; Casey Wasserman - Tuesday, July 21","The pandemic continues to impact all parts of life, including sports. As sports programs resume, what safeguards are needed to ...",Non-political
Khan Academy,Modeling with multiple variables: Pancakes | Modeling | Algebra || | Khan Academy,Modeling the relationship between three quantities (or more) isn't that different from modeling the relationship between two ...,Non-political
Khan Academy,Corona Virus (COVID-19) discussion with Bill Gates,Bill Gates joins Sal Khan to discuss how the world is responding to and changing with COVID-19. For more information visit: ...,Non-political
Khan Academy,Teacher Tim Vandenberg shares how mastery learning worked for his class | Homeroom with Sal,Teacher Tim Vandenberg's students have achieved off-the-charts progress by using Khan Academy's course mastery! He'll join us ...,Non-political
Khan Academy,Khan Academy Kids: Celebrating First Words Through First Grade,Khan Academy Kids is an award-winning educational app for young learners ages two to seven. The app engages kids in core ...,Non-political
Khan Academy,Guided meditation for students,"Many students have asked Sal how to cope with stress. In his personal life, Sal finds meditation invaluable for not only reducing ...",Non-political
Khan Academy,Causation from 1980-2020,Keep going! Check out the next lesson and practice what you're learning: ...,Non-political
Khan Academy,What to do the night before an exam: 3 tips from Sal Khan,"Taking an important exam like the SAT, Praxis, or LSAT tomorrow? We can help! Sal Khan shares 3 quick tips to help you put your ...",Non-political
Khan Academy,Slope and intercept in tables,Keep going! Check out the next lesson and practice what you're learning: ...,Non-political
Khan Academy,Pattern when dividing by tenths and hundredths,Pattern when dividing by tenths and hundredths.,Non-political
Khan Academy,Division resulting in decimals example 2,Keep going! Check out the next lesson and practice what you're learning: ...,Non-political
Khan Academy,Setting up systems of linear equations example,Keep going! Check out the next lesson and practice what you're learning: ...,Non-political
Khan Academy,Triple bonds cause linear configurations | Organic chemistry | Khan Academy,Linear geometry of a triple bond. Created by Sal Khan. Watch the next lesson: ...,Non-political
Khan Academy,Review of revenue and cost graphs for a monopoly | Microeconomics | Khan Academy,Let's review what we've learned about monopolies Watch the next lesson: ...,Non-political
Khan Academy,Why is the Speaker second in succession? | US Government and Civics | Khan Academy,John Dickerson introduces us to the 25th Amendment and explains why the Speaker of the House is second in succession to the ...,Non-political
Khan Academy,Khan Stories: Claudia,"When Claudia's parents brought her and her family to South Florida from the Azores Islands, they equipped her with just about all ...",Non-political
Khan Academy,Sal Khan &amp; John Dickerson: introduction | US government and civics | Khan Academy,Sal Khan and John Dickerson kick off a series of videos focused on how current events relate to US history and civics.,Non-political
Khan Academy,Chain rule | Derivative rules | AP Calculus AB | Khan Academy,Courses on Khan Academy are always 100% free. Start practicing—and saving your progress—now: ...,Non-political
Khan Academy,Ideologies of political parties in the United States | US government and civics | Khan Academy,Courses on Khan Academy are always 100% free. Start practicing—and saving your progress—now: ...,Non-political
Khan Academy,Hypotheses for a two-sample t test | AP Statistics | Khan Academy,Courses on Khan Academy are always 100% free. Start practicing—and saving your progress—now: ...,Non-political
Khan Academy,Example: Intersection of sine and cosine | Graphs of trig functions | Trigonometry | Khan Academy,Courses on Khan Academy are always 100% free. Start practicing—and saving your progress—now: ...,Non-political
Khan Academy,Conditions for a t test about a mean | AP Statistics | Khan Academy,Courses on Khan Academy are always 100% free. Start practicing—and saving your progress—now: ...,Non-political
Khan Academy,Arteries vs. veins-what&#39;s the difference? | Circulatory system physiology | NCLEX-RN | Khan Academy,Courses on Khan Academy are always 100% free. Start practicing—and saving your progress—now: ...,Non-political
Khan Academy,Federalism in the United States | US government and civics | Khan Academy,Courses on Khan Academy are always 100% free. Start practicing—and saving your progress—now: ...,Non-political
Khan Academy,Give to Khan Academy today!,Give today: http://khan.co/DonateKA ❤️   Khan Academy is a nonprofit that relies on support from people like you. We've ...,Non-political
Khan Academy,Interpreting a quadratic in factored form,Interpreting a quadratic in factored form.,Non-political
Khan Academy,The social contract | Foundations of American democracy | US government and civics | Khan Academy,Courses on Khan Academy are always 100% free. Start practicing—and saving your progress—now: ...,Non-political
Khan Academy,Analyzing related rates problems: equations (trig) | AP Calculus AB | Khan Academy,Courses on Khan Academy are always 100% free. Start practicing—and saving your progress—now: ...,Non-political
Khan Academy,Limit of sin(x)/x as x approaches 0 | Derivative rules | AP Calculus AB | Khan Academy,Courses on Khan Academy are always 100% free. Start practicing—and saving your progress—now: ...,Non-political
Khan Academy,Inca Empire overview | World History | Khan Academy,Courses on Khan Academy are always 100% free. Start practicing—and saving your progress—now: ...,Non-political
Khan Academy,Feudal system during the Middle Ages | World History | Khan Academy,Courses on Khan Academy are always 100% free. Start practicing—and saving your progress—now: ...,Non-political
Khan Academy,Graphing parabola from quadratic in factored form,Graphing parabola from quadratic in factored form.,Non-political
Vsauce,This Book Will Put You To Sleep,,Non-political
Vsauce,Popcorn On The Cob,,Non-political
Vsauce,Putting a Penny on John Wilkes Booth&#39;s Grave,,Non-political
Vsauce,A &#39;Light-Year&#39; Of Water,https://www.curiositybox.com/,Non-political
Vsauce,​,,Non-political
Vsauce,The Ultimate Alphabet,,Non-political
Vsauce,An Infinite Dilemma of Bliss and Suffering,"Watch my video ""how to count past infinity"": https://www.youtube.com/watch?v=SrU9YDoXE88.",Non-political
Vsauce,Do You Have a Simian Line?,,Non-political
Vsauce,The Book Bush Was Reading on 9/11,,Non-political
Vsauce,Exploding Bubbles,https://melscience.com/,Non-political
Vsauce,Can Your Thumb Do This?,https://my.clevelandclinic.org/health/diseases/23118-hitchhikers-thumb https://en.wikipedia.org/wiki/Hitchhiker%27s_thumb ...,Non-political
Vsauce,The Word With The Most Definitions.,https://www.nytimes.com/2011/05/29/opinion/29winchester.html ...,Non-political
Vsauce,Dueling Proverbs,,Non-political
Vsauce,Our Magnetic Top,Subscribe now! There's still time to join and get the box this top will come in!! https://www.curiositybox.com/,Non-political
Vsauce,The Real Reason Flames Don&#39;t Have Shadows,https://www.wtamu.edu/~cbaird/sq/2015/12/01/can-a-fire-have-a-shadow/ ...,Non-political
Vsauce,The Only Element You Can Chew Like Gum,,Non-political
Vsauce,Forbidden Spellings,spelling bee? more like spelling A+.,Non-political
Vsauce,The People Who Were Turned Into Paint,https://harvardartmuseums.org/article/a-pigment-from-the-depths ...,Non-political
Vsauce,If Numbers Were Alphabetized,Roman Numerals in alphabetic order: ...,Non-political
Vsauce,Thermite Balls,learn more: http://blog.teachersource.com/2010/06/13/great-balls-and-fire-smashing-steel-spheres/,Non-political
Vsauce,The McGurk Effect,,Non-political
Vsauce,The Highest-Scoring Move in Scrabble,"For a little more info, check out the longer version on my TIkTok (I can make videos over 1 minute there): ...",Non-political
Vsauce,It&#39;s Like a Giant Bell IN YOUR HEAD,"I discovered this wacky trick in Martin Gardner's fabulous 1981 book, ""Entertaining science experiments with everyday objects""",Non-political
Vsauce,ABC3D,Marion Bataille's ABC3D.,Non-political
Vsauce,Denary Dice,"d1, d2, d3, d4, d5, d6, d7, d8, d9, d10 http://www.CuriosityBox.com CODE ""1""",Non-political
Vsauce,the circle dot trick,,Non-political
Vsauce,How Dark Is It On Pluto?,PLUTO TIME CALCULATOR: https://solarsystem.nasa.gov/planets/dwarf-planets/pluto/plutotime/,Non-political
Vsauce,Cooling down water by BOILING it,,Non-political
Vsauce,The Obama Kissing Rock,,Non-political
Vsauce,"An Engineer, a Biologist, and a Mathematician",,Non-political
Vsauce,Let&#39;s Watch A Minute Hand For One Minute,,Non-political
Vsauce,We Still Can&#39;t Explain This Illusion,LEARN MORE: https://www.sciencedirect.com/science/article/pii/S0042698920300730 ...,Non-political
Vsauce,Hurricane Balls,"Hurricane Balls Curiosity Box! PRE-ORDER WITH CODE ""BALLS"" TO SAVE $20 ⚪️⚪️ CuriosityBox.com ⚪️⚪️ We ...",Non-political
Vsauce,The Very First Apple Watch (1995),The FIRST Apple watch (1995) #apple #watch #history #macintosh #memphisgroup #AlainSilberstein #design #90s ...,Non-political
Vsauce,Large Numbers,(Conway-Guy system),Non-political
Vsauce,Vanadium Sulfur Gold Cerium,"We made these coasters almost 6 years ago, and I just found out that we still have some! You can pick them up here: ...",Non-political
Vsauce,Which Letter Is Never Silent?,https://www.merriam-webster.com/words-at-play/mums-the-letter-when-letters-dont-say-a-thing.,Non-political
Vsauce,A Better Order For The Alphabet?,PUPPET BY @PuppetNerd :),Non-political
Vsauce,Let&#39;s Cut Mount Everest In Half,let's cut Mt. Everest in half #Qomolangma #Chomolungma #ཇོ་མོ་གླང་མ #everest #GeorgeEverest #earth #geology #flat ...,Non-political
Vsauce,The Missing Cookie Illusion,off with code ILLUSION at http://www.CuriosityBox.com !!!!,Non-political
Vsauce,789,,Non-political
Vsauce,Which Will Win?,,Non-political
Vsauce,The Day After The Moon Landing,,Non-political
Vsauce,What Are The Most-Used Words?,"if you like this, check out my video on the Zipf Mystery: https://youtu.be/fCn8zs912OE.",Non-political
Vsauce,The Joke That Accidentally Became A &#39;Fact&#39; @JoeKwaczala,JoeKwaczala.,Non-political
Vsauce,The Baker Test,,Non-political
Vsauce,How To Spell Diarrhea,,Non-political
Vsauce,The Most Valuable Thing I Own,HowToBasic #howtobasic #performanceart.,Non-political
Vsauce,How Old Is The Water You Drink?,footage sources: https://www.eso.org/public/videos/eso1626c/ ...,Non-political
Vsauce,Expired Soda Eating Through Metal,,Non-political
TED-Ed,How to enter flow state,"Explore the defining features of being in a flow state, and get tips on how you can find flow in your daily life. -- Flow is more than ...",Non-political
TED-Ed,Science vs. Pseudoscience - Siska De Baerdemaeker,"Get to know 3 factors that can help you identify pseudoscience, and find out how it differs from actual science. -- Pseudoscience is ...",Non-political
TED-Ed,Why is Marie Antoinette so controversial? - Carolyn Harris,Marie Antoinette became a symbol for the evils of excess— but was she a wasteful queen or a convenient scapegoat? You decide ...,Non-political
TED-Ed,Who is the fastest creature in mythology? - Iseult Gillespie,Witness the clash of mythology's speediest supernaturals in an epic race and find out which creature is the fastest. -- It's time for ...,Non-political
TED-Ed,What happens if an engineered virus escapes the lab?,How do we keep labs that handle dangerous pathogens safe and leak-free? Dig into the ongoing debate over virology research.,Non-political
TED-Ed,A brief history of Spanish - Ilan Stavans,"Trace the history and evolution of the Spanish language, from its origins in the 3rd century BCE to modern day. -- Beginning in the ...",Non-political
TED-Ed,Why a sausage can do what your gloves cannot - Charles Wallace and Sajan Saini,"Dig into the science of touchscreens, and find out the difference between the two most common types: capacitive and resistive.",Non-political
TED-Ed,This weird trick will help you summon an army of worms - Kenny Coogan,"Discover the tradition of worm grunting, and find out why earthworms come to the surface when they sense vibrations in the earth.",Non-political
TED-Ed,The true cost of gold -  Lyla Latif,"Dig into how foreign corporations exploit African nations like Mali for their gold mining, and often rob them of proper compensation ...",Non-political
TED-Ed,The 4 greatest threats to the survival of humanity,"Dig into the 4 biggest existential risks that threaten the survival of humanity, and explore how we can safeguard our future.",Non-political
TED-Ed,"What causes yeast infections, and how do you get rid of them? - Liesbeth Demuyser","Explore the common causes and treatments of yeast infections, which affect 3 out of every 4 people with a vagina. -- The vagina ...",Non-political
TED-Ed,The smallest solution to one of our biggest problems - Tierney Thys &amp; Christian Sardet,Explore the possibility of plastivores— organisms that can eat and break down plastic— helping reduce the plastic waste on Earth.,Non-political
TED-Ed,How does alcohol cause hangovers? - Judy Grisel,"Discover how alcohol impacts your body's processes and causes hangovers, and find out what causes the most common ...",Non-political
TED-Ed,What’s the best country to live in?,"Discover the shortcomings of using GDP to measure a country's well-being, and what alternatives can be used to gauge quality of ...",Non-political
TED-Ed,What happens to your body at the top of Mount Everest - Andrew Lovering,Explore what happens in your body when you don't acclimate to higher altitudes and the dangers of altitude sickness. -- If you ...,Non-political
TED-Ed,Why can parrots talk? - Grace Smith-Vidaurre and Tim Wright,"Explore the specialized anatomy that allows parrots to talk, scream, curse, and recite facts like humans. -- Whether they're belting ...",Non-political
TED-Ed,A brief history of dumplings - Miranda Brown,"Trace the diverse and delicious history of dumplings, from their first recorded origins to their spread across the Asian continent ...",Non-political
TED-Ed,How does heart transplant surgery work? - Roni Shanoada,"Dig into the science of how heart transplants happen, how donors are matched and find out how this complex surgery saves lives.",Non-political
TED-Ed,Why are eating disorders so hard to treat? - Anees Bahji,"Dig into the psychiatric conditions of eating disorders, and explore the complex effects they have on the body and mind. -- Globally ...",Non-political
TED-Ed,Do tax cuts stimulate the economy? - Jonathan Smith,"Dig into trickle-down economics, which claims that tax cuts for corporations and the wealthy stimulate the economy and improve ...",Non-political
TED-Ed,The biggest mistakes in mapmaking history - Kayla Wolf,Travel through the history of mapmaking and discover what big mistakes cartographers made about the world's geography.,Non-political
TED-Ed,The Irish myth of Diarmuid’s betrayal - Iseult Gillespie,"Dig into the Irish myth of lovers Gráinne and Diarmuid, and follow their journey as they flee from her betrothed, Fionn. -- Gráinne ...",Non-political
TED-Ed,The myth of the original star-crossed lovers - Shannon Zhao,"Get to know the myth of the weaver and the cowherd, a pair of star-crossed lovers banished to opposite sides of the Milky Way.",Non-political
