Channel Name,Title,Description,Political Affiliation
Vox,A fact-checked debate about legal weed,2 opposing perspectives and 6 true facts about cannabis legalization. Subscribe and turn on notifications so you don't miss any ...,Left
Vox,Why population pyramids aren&#39;t always pyramid-shaped #shorts,"If you're interested in another country, Google “Census.gov” and “population pyramid”. By Laura Bult. Source: United States ...",Left
Vox,"The World Cup controversy around Iran’s flag, explained #shorts",By Coleman Lowndes Subscribe to our channel and turn on notifications (  ) so you don't miss any videos: http://goo.gl/0bsAjO ...,Left
Vox,Batteries are dirty. Geothermal power can help.,"A better future can't just be green, it must also be fair. Subscribe and turn on notifications so you don't miss any videos: ...",Left
Vox,How to build a wood skyscraper,Mass timber has gone from novelty to trend. But how does it change the construction process? Subscribe and turn on notifications ...,Left
Vox,Why this football pass seems physically impossible,The way a football moves through the air is almost paradoxical. Subscribe and turn on notifications so you don't miss any ...,Left
Vox,How Ukraine got the upper hand against Russia,"Ukraine's breakthrough counterattack, explained. Subscribe and turn on notifications so you don't miss any videos: ...",Left
Vox,Humans finally figured out how to make it rain,"Cloud seeding, explained. We flew up to see it with our own eyes. Subscribe and turn on notifications so you don't miss any ...",Left
Vox,How F1 racers turn really fast,It's all about using the entire width of the road and finding the ideal line. Subscribe and turn on notifications (  ) so you don't miss ...,Left
Vox,This high-speed rail project is a warning for the US,"California's ""train to nowhere"" shows the challenges ahead. Subscribe and turn on notifications so you don't miss any videos: ...",Left
Vox,Why US gun laws get looser after mass shootings,Congress has rarely acted. But gun laws have been changing. Subscribe and turn on notifications so you don't miss any ...,Left
Vox,Why US schools are at the center of trans rights,A civil rights battle with transgender kids caught in the middle. Subscribe and turn on notifications so you don't miss any videos: ...,Left
Vox,4 ways Americans are still getting abortion pills,Banning abortion doesn't eliminate the need for it. Subscribe and turn on notifications so you don't miss any videos: ...,Left
Vox,Why motion capture is harder than it looks,The suits are just the beginning of the motion capture process. Subscribe and turn on notifications so you don't miss any ...,Left
Vox,How abortion bans make inequality worse,And the study that offers a glimpse into a post-Roe v. Wade future. Subscribe and turn on notifications so you don't miss any ...,Left
Vox,How the “lost cities” of the Amazon were finally found,And why they were so hard to see Subscribe and turn on notifications so you don't miss any videos: http://goo.gl/0bsAjO The ...,Left
Vox,"Drag kings, explained by drag kings","Mo B. Dick, Maxxx Pleasure, Sigi Moonlight, Johnny Gentleman, and King Molasses explain the evolution of drag. Subscribe and ...",Left
Vox,Why roller coaster loops aren&#39;t circular,The G forces were out of this world. Subscribe and turn on notifications so you don't miss any videos: http://goo.gl/0bsAjO If ...,Left
Vox,Why shipping container homes are overrated,They're fun. They're also way more difficult to build than they seem. Subscribe and turn on notifications so you don't miss any ...,Left
Vox,"The text-to-image revolution, explained","How programmers turned the internet into a paintbrush. DALL-E 2, Midjourney, Imagen, explained. Subscribe and turn on ...",Left
Vox,Why Germany is hooked on Russian gas,How Germany got stuck paying for Russia's war. Subscribe and turn on notifications so you don't miss any videos: ...,Left
Vox,The hidden history of “Hand Talk”,The hidden history of an ancient language. Subscribe and turn on notifications so you don't miss any videos: ...,Left
Vox,"The world&#39;s biggest wave, explained",And how it's transformed a Portuguese town. Subscribe and turn on notifications so you don't miss any videos: ...,Left
Vox,Why Frank Lloyd Wright’s windows look like this,Natural light was an obsession — and he worked hard to let it in. Subscribe and turn on notifications so you don't miss any ...,Left
Vox,How “Z” became Putin’s new propaganda meme,The letter now signifies loyalty to the Russian president. Subscribe and turn on notifications so you don't miss any videos: ...,Left
Vox,The banned weapon Russia (and the US) won’t give up,Why war crimes investigators are looking for cluster bombs in Ukraine. Subscribe and turn on notifications so you don't miss ...,Left
Vox,What Russia&#39;s war means for the International Space Station,Can the US and Russia still collaborate in space? Subscribe and turn on notifications so you don't miss any videos: ...,Left
Vox,How Ukrainians are saving art during the war,And the long history of why protecting physical culture matters. Subscribe and turn on notifications so you don't miss any ...,Left
Vox,Why everyone has this chair,This two-legged chair has been famous for almost 100 years. Subscribe and turn on notifications so you don't miss any videos: ...,Left
Vox,How China uses fruit to punish Taiwan,"It's not just about fruit. Subscribe and turn on notifications so you don't miss any videos: http://goo.gl/0bsAjO In September 2021, ...",Left
NBC News,The rebirth of the American chestnut,"As the planet changes, researchers are turning to gene editing to help revive struggling plants. NBC's Noah Pransky looks at how ...",Left
NBC News,Why crochet is becoming popular among young adults,"Crochet has often been viewed as an ""old-person"" activity, but Gen Z is now embracing it on social media. NBC News' Maya ...",Left
NBC News,Bear cools off in Southern California pool,"Police say a bear was spotted wandering in a hillside neighborhood before taking a tip in a backyard pool in Burbank, California.",Left
NBC News,Five people injured in Seattle shooting,"Authorities say least five people were injured, two critically, in a shooting in a parking lot in Seattle » Subscribe to NBC News: ...",Left
NBC News,NBC documentary examines &#39;Cop City&#39; controversy,"Just north of Atlanta, Georgia, a controversial and massive training facility for police is moving forward despite resistance from ...",Left
NBC News,Charges dropped against 7 Oklahoma police officers in fatal 2020 shootings,District Attorney Vicki Behenna announced she is dropping criminal charges against seven police officers in three separate fatal ...,Left
NBC News,India&#39;s ban on rice export triggers panic buying across the U.S.,"Officials in India imposed a ban on the export of non-basmati white rice which has led to panic buying across the U.S., leaving ...",Left
NBC News,Hurd booed over Trump comments at GOP Lincoln Dinner,"Former Rep. Will Hurd, who is running for the Republican presidential nomination, was booed after commenting that Trump is only ...",Left
NBC News,U.S. orders government personnel to leave Haiti amid civil unrest,The State Department has ordered all U.S. government employees along with non-emergency personnel and their families to ...,Left
NBC News,Judge orders three of ‘Newburgh Four’ to be released from prison,A federal judge ordered three of the four men convicted of plotting to carry out acts of terrorism in New York to be released from ...,Left
NBC News,Top Story with Tom Llamas - July 28 | NBC News NOW,"Millions across the U.S. under heat alerts, DeSantis blasted for Florida Black history standards, Three of the ""Newburgh Four"" to ...",Left
NBC News,Stay Tuned NOW with Gadi Schwartz - July 28 | NBC News NOW,"Trump hits campaign trail amid mounting legal troubles, Carlee Russell charged in connection with fake abduction, CDC issues ...",Left
NBC News,More than 100 trans men enter Italian pageant after contest bans trans women,"After a pageant representative said transgender women could not compete in the Miss Italy contest, more than 100 transgender ...",Left
NBC News,Nightly News Full Broadcast - July 28,Trump reacts to additional charges over Mar-a-Lago classified documents case; DeSantis responds to backlash over new public ...,Left
NBC News,Schumer slams GOP lawmaker for reportedly cursing at Senate pages,"Senate Majority Leader Chuck Schumer, D-N.Y., delivered remarks on the Senate floor addressing a GOP lawmaker reportedly ...",Left
NBC News,Hallie Jackson NOW - July 28 | NBC News NOW,"Millions of people in the U.S. continue to swelter in record-breaking heat, Carlee Russell now facing charges in her apparently ...",Left
NBC News,Walmart using AI to streamline organization – what will it mean for workers?,Walmart is using artificial intelligence to help streamline their product organization. That raises questions about how workers' jobs ...,Left
NBC News,McConnell freezing during news conference sparks concern over lawmakers’ ages,"For America's lawmakers, seniority has long meant power and prestige but now it might also be a political liability. Senate Minority ...",Left
NBC News,"Amusement park ride fails to stop in Rye, New York","An amusement park ride in Rye, New York wouldn't stop earlier this week as park goers pleaded to pull the plug. It's the latest ...",Left
NBC News,July set to become hottest month in history,July is expected to become the hottest month in history as 35 states are under heat alerts. NBC News' Miguel Almaguer reports on ...,Left
NBC News,DeSantis responds to backlash over new public school teaching standards,Florida Governor DeSantis is facing mounting criticism over new public school standards in the state that teach “how slaves ...,Left
NBC News,Trump reacts to additional charges over Mar-a-Lago classified documents case,Former President Trump says he did “nothing wrong” after the special counsel alleged Trump sought to cover up classified ...,Left
NBC News,&#39;All that talk and no action&#39;: Biden forgets to sign executive order,President Biden returned to the Maine stage after delivering remarks on manufacturing because he forgot to sign his executive ...,Left
NBC News,"President Biden acknowledges 7th grandchild, daughter of Hunter","President Joe Biden publicly acknowledged his seventh grandchild for the first time, while adding that the child, who is the ...",Left
NBC News,"GOP primary debates will highlight DeSantis’ ‘brainpower,’ says Cuccinelli",Gov. Ron DeSantis (R-Fla.) looks to reset his presidential campaign amid campaign finance concerns and backlash around his ...,Left
NBC News,WATCH: Ohio bank burglar arrested after dropping from ceiling,"An Ohio bank burglary suspect was arrested after he dropped into a recycling trash bin from the bank's attic, only to find officers ...",Left
NBC News,Superseding Trump indictment ‘blows out of the water&#39; the primary Mar-a-Lago defenses,NBC News Senior Legal Correspondent Laura Jarrett and NBC News Legal Analyst Danny Cevallos discuss the fallout from ...,Left
NBC News,Man stunned by deputy before being fatally hit by car,Newly released body camera footage shows the moment when a 28-year-old man was stunned by a #Colorado sheriff's deputy ...,Left
NBC News,Virginia school board meeting on transgender policies ends in chaos,Protesters were removed and arrests were made at a Roanoke County School Board meeting on new transgender policies.,Left
NBC News,White House &#39;closely monitoring&#39; attempted coup in Niger,Niger's democratically elected president is being detained by a group of soldiers and the U.S. is calling for his immediate release.,Left
NBC News,"Black man mauled by K9 while trying to surrender, says he feared for his life","Jadarrius Rose, a Black man who was attacked by a police dog in #Ohio as he was trying to surrender, says he was afraid for his ...",Left
NBC News,Carlee Russell charged in kidnapping hoax,Alabama authorities have charged Carlee Russell with two misdemeanors after she admitted to falsely reporting she'd been ...,Left
NBC News,Missing Arizona teen found nearly four years later,"A major search for a 14-year-old girl who disappeared from the #Phoenix, #Arizona, area nearly 4 years ago ended when the ...",Left
NBC News,LIVE: NBC News NOW,"NBC News NOW is live, reporting breaking news and developing stories in real time. We are on the scene, covering the most ...",Left
NBC News,‘Everything is destroyed’: Amateur video shows explosion site in Taganrog,"Russia claims the explosion that damaged buildings and injured several people in Taganrog, near the Ukraine border, was ...",Left
NBC News,Northeast experiencing hottest days of the year as heat wave continues,"As extreme heat continues to blanket the U.S., Americans in the Northeast are experiencing their hottest days of the year with ...",Left
NBC News,Runner with one leg attempts marathon on crutches to protest prosthesis prices,"After losing his leg to bone cancer when he was 15 years old, runner Alex Parra learned he couldn't afford a specialized $35000 ...",Left
NBC News,New details revealed in hearing for Michigan school gunman,Security video showing Ethan Crumbley's deadly shooting rampage inside Michigan's Oxford High School was played in court.,Left
NBC News,Morning News NOW Full Broadcast - July 28,"Former President Donald Trump faces new charges in connection with his handling of classified documents, extreme heat ...",Left
NBC News,Suspect in fatal California stabbing arrested after posting video of attack online,"Authorities say Mark Merchikoff was arrested in connection to the fatal stabbing of a woman in San Mateo, California, after a video ...",Left
NBC News,This Morning’s Top Headlines – July 28,Former President Donald Trump faces new charges in connection with his handling of classified documents at Mar-a-Lago after ...,Left
NBC News,Three ‘stooges’ of robots make life easier at Colorado retirement home,"Holly Creek retirement community, an assisted living facility in Centennial, Colorado, is getting a helping hand from a trio of robots ...",Left
NBC News,Triple-digit temperatures threatening saguaro cacti in Arizona,Researchers say the record-breaking stretch of heat waves and multiple days of triple-digit temperatures are scorching and ...,Left
NBC News,Watch: 93-year-old man hikes to summit of Yosemite’s half dome,Video captured the moments when 93-year-old Everett Kalin hiked to the formidable half dome summit in Yosemite National Park.,Left
NBC News,11-year-old Florida girl arrested after falsely reporting kidnapping,"Authorities in Volusia County, Florida, say an 11-year-old girl was arrested and charged with a felony after she texted 911 to ...",Left
NBC News,Bodycam video shows Colorado man tased by deputy before being fatally struck by car,Body camera footage shows the moment when 28-year-old Brent Thompson was tased by a sheriff's deputy before being hit by a ...,Left
NBC News,"Jets, cars and BBQ: What&#39;s in the latest campaign finance reports","Jets, cars and BBQ: What's in the latest #campaign finance reports. » Subscribe to NBC News: http://nbcnews.to/SubscribeToNBC ...",Left
NBC News,Stay Tuned NOW with Gadi Schwartz - July 27 | NBC News NOW,"Trump faces additional charges in classified documents case, July on track to be the hottest month ever recorded, Allegiant plane ...",Left
NBC News,&#39;I just didn’t want to lose my life&#39;: says Black man mauled by police K9,"In an exclusive interview with NBC News, Jadarrius Rose, the Black man mauled by a police K9 in Ohio, opened up about the ...",Left
NBC News,Nightly News Full Broadcast - July 27,Trump faces new charges in Mar-A-Lago classified documents case; Michigan judge to decide if Oxford school shooter should get ...,Left
PragerU,James Buchanan: A Legacy of Failure,"UBSCRIBE https://www.prageru.com/join When James Buchanan—America's 15th president—took office, the country was ...",Right
PragerU,Dennis&#39;s Birthday Wish with Jordan Peterson,Donate now! - https://l.prageru.com/3Ki7uvp #nonprofit #jordanpeterson #shorts.,Right
PragerU,Don&#39;t Let the Left Fool You: Where&#39;s Their Proof?,SUBSCRIBE https://www.PragerUkids.com #shorts #parents #education.,Right
PragerU,Why Leftists Don&#39;t Want Dennis to Speak,Watch Dennis Testify at ASU - https://www.youtube.com/watch?v=95MgIvSVnq8&t=955s #shorts #testimony.,Right
PragerU,Her Views of Marriage are Warped,AmalaEkpunobiUnapologetic #shorts #relationship.,Right
PragerU,"Death on the Obama Estate, Congress Investigates UFOs, Hunter Biden Plea Deal Dead: 7/28/2023",A mysterious death near the Obama estate is raising questions. Hunter Biden pleads not guilty to tax and gun crimes after a plea ...,Right
PragerU,Are Things Actually Worse or Merely a Social Media Perception?,AmalaEkpunobiUnapologetic #socialmedia #woke #shorts.,Right
PragerU,Fireside Chat Ep. 299 — Do You Trust the Government to Define &quot;Misinformation&quot;?,"Watch The Full Episode: https://l.prageru.com/44Kyrjx According to Pew Research Center, most Americans want the government ...",Right
PragerU,Woman Supports 5-Year-Old Changing Gender,Watch The Full Episode: https://l.prageru.com/3KedBAI #gender #parents #shorts.,Right
PragerU,Black Culture: Is This a Stereotype,realcjpearson #blackculture #respect #reaction.,Right
PragerU,Know Your Tax Forms: W-2 &amp; W-4,"SUBSCRIBE https://www.PragerUkids.com Tax forms may seem confusing to your teens, but this video will teach them what ...",Right
PragerU,Overcoming Adversity: A Shared Trait Among Successful Entrepreneurs,realtalkwithmarissa Watch The Full Episode: https://l.prageru.com/43BiSsW #entrepreneur #success #ceos.,Right
PragerU,Would You Support an Assault Weapons Ban?,aldobuttazzoni #manonthestreet #assaultrifle #2ndamendment.,Right
PragerU,California Wants to be Your Daddy,PragerUKids #california #gender #parents.,Right
PragerU,Would You Support an Assault Weapons Ban?,"SUBSCRIBE https://www.prageru.com/join @aldobuttazzoni Should America ban so-called ""assault weapons""? What about ...",Right
PragerU,Four Times More Deaths Caused by Knives than Rifles,aldobuttazzoni #2ndamendment #crime #manonthestreet.,Right
PragerU,Replicating Genitals with Piercings?,AmalaEkpunobiUnapologetic #piercing #lgbt #gender.,Right
PragerU,"Parent Alert! BIG WINS, COMING FROM CA, IN EDUCATION:","The left flips out over PragerU Kids now being approved for Florida schools, Chino Valley Unified Schools votes to honor parental ...",Right
PragerU,Is There a Government Agenda with Food? Follow the Money!,Watch The Full Episode: https://l.prageru.com/3Ds8BVl #food #health #government.,Right
PragerU,"Calley Means: Pharma, Food, Government — Follow the Money",SUBSCRIBE https://www.prageru.com/join “Big Food” and “Big Pharma” insider Calley Means always wanted to effect positive ...,Right
PragerU,Street Smarts: The U.S. Senate,"SUBSCRIBE https://www.PragerUkids.com The Senate is an important part of the U.S. government, but do your kids know why?",Right
PragerU,A Message from Our CEO: PragerU Is Now in Schools,PragerU CEO Marissa Streit has a HUGE ANNOUNCEMENT that could change education in America! This fall in schools across ...,Right
PragerU,How Dangerous Is Nuclear Waste?,"UBSCRIBE https://www.prageru.com/join Even environmentalists concede that nuclear power is a clean source of abundant, ...",Right
PragerU,"IQ Decline, Depression, Anxiety Linked to Excessive Screentime: Join Our 30-Day Detox",Sign up for the 30-Day Brian Detox: https://l.prageru.com/3K1Boni #mentalhealth #happiness #detox.,Right
PragerU,Why Is China Exempt from ESG Policies?,realtalkwithmarissa #ESG #blackrock #woke.,Right
PragerU,John Kerry&#39;s Under Oath Lies and Climate Hypocrisy Exposed,aldobuttazzoni #johnkerry #politics.,Right
PragerU,Fireside Chat Ep. 298 — CDC Using &quot;Pregnant People&quot;,Watch The Full Episode: https://l.prageru.com/3XYA2zq Now that the Centers for Disease Control and Prevention (CDC) is using ...,Right
PragerU,Dennis Prager Testifies at Arizona State Legislature on ASU Censorship,"SUBSCRIBE https://www.prageru.com/join On July 18, 2023, Dennis Prager testified in front of Arizona state legislators on a ...",Right
PragerU,"Jubilee Reaction, Reddit AITA, &amp; IT’S MY BIRTHDAY!!",Subscribe to my weekly email update! https://www.prageru.com/series/unapologetic What's up guys! Today's my birthday and to ...,Right
PragerU,How To Ask For Help,"SUBSCRIBE https://www.PragerUkids.com It's important to ask for help when you really need it, but some young people find it ...",Right
PragerU,Unwoke Inc.,Take the pledge to fight corporate wokeism. - https://l.prageru.com/45RpOod SUBSCRIBE https://www.prageru.com/join Why ...,Right
PragerU,Canada: Marcel Makes a Sacrifice,"Do your kids understand the true cost of ""free"" healthcare? In this animated Around the World video for tweens and teens, they'll ...",Right
PragerU,Is the U.S. Southern Border Collapsing?,aldobuttazzoni travels to the “How Many More?” rally at the Texas State Capitol and speaks with residents who are demanding an ...,Right
PragerU,Fireside Chat Ep. 288 — You Should Have Shoulds in Life,"Dennis offers words of wisdom to live by, as he shares his three favorite verbs. Can you guess what they are? These three simple ...",Right
PragerU,Tyre Nichols and Police Brutality,"SUBSCRIBE https://www.prageru.com/join Is police brutality a major problem in America? Many activists, politicians, and the ...",Right
PragerU,Are we still going to act like this isn&#39;t a women&#39;s safety issue?,Is this a death threat?,Right
PragerU,Why Are Energy Prices So Frickin’ High? with Chris Wright,SUBSCRIBE https://www.prageru.com/join We're told the Earth is experiencing a climate crisis and that manmade emissions ...,Right
PragerU,Could the CEO of Best Buy Start That Company Today?,"America needs more entrepreneurs like Brad Anderson—the former CEO of Best Buy. Against all odds, he took a failing business ...",Right
PragerU,William Henry Harrison: President for 31 Days,"Watch PragerU's American Presidents series: https://l.prageru.com/3IjUsLU William Henry Harrison, the first Whig president, died ...",Right
PragerU,John Quincy Adams: Dedicated to America,"John Quincy Adams, the son of the second President of the United States, became the sixth President of the United States. But the ...",Right
PragerU,The Constitution: The Civil Rights Amendments,"After the Civil War ended in 1865, Americans began the business of reconstructing their country, and along with it, their ...",Right
PragerU,Dave Rubin Reports on His Trip to Twitter HQ (&amp; His Obsession with Florida),"Comedian, host, and author Dave Rubin was a self-described “classical liberal” who famously “left the left” in 2017 when he ...",Right
PragerU,Canadian Woman DIES After Waiting 7 Hours In ER | Family Wants ANSWERS,Why can't America's healthcare system be more like Canada's? Here's a better question: why would you want it to be? #canada ...,Right
PragerU,The Constitution: A Nation of States,How did thirteen separate colonies become the United States of America? The answer is found in the second half of the American ...,Right
PragerU,Fireside Chat Ep. 271 — Protect Children’s Innocence: It’s the Adults’ Job,Watch the full episode of this Fireside Chat: https://l.prageru.com/3GFIwn7 It is the job of adults to protect children. But for the first ...,Right
PragerU,Confessions of an Environmentalist,Imagine you dedicated your life to environmentalism and all of its assumptions. Then imagine you realize those assumptions are ...,Right
PragerU,Fireside Chat Ep. 270 — Should All Murderers Live?,Watch the full episode of this Fireside Chat: https://l.prageru.com/3GGBm38 What does justice look like for the college students ...,Right
PragerU,Do What You Fear,"What most prevents people from living a happy, fulfilling, and meaningful life? And, what causes people to act irrationally?",Right
PragerU,The Constitution: Our Bill of Rights,"Did you know that freedom of speech, freedom of religion, and the right to bear arms were not in the original Constitution, drafted ...",Right
PragerU,Fireside Chat Ep. 62 - How You Can Be Happy (Re-Release),"Watch the full episode of this Fireside Chat: https://l.prageru.com/3FgXTmn This week, Dennis shares an important message ...",Right
The Next News Network,Public Reacts to Border Crisis,"Border crisis, smartphone app fixes, and shell games. Just another day in the land of 'order.' And 94% of us see through the ...",Right
The Next News Network,"Trump, Cocaine, and Secret Service","Trump sprinkling a bit of intrigue into the White House 'snow' saga. A case of Secret Service secrets, or just a blizzard of ...",Right
The Next News Network,FBI&#39;s Biden Probe Questioned,Who knew political dramas weren't just for Netflix? Seems like our friends at the FBI are caught up in a plot twist with the Biden ...,Right
The Next News Network,Biden Misleading on Mental Health Hotline Success,Biden taking credit for Trump's mental health hotline is like claiming a hole-in-one after someone else made the shot. Typical ...,Right
The Next News Network,White House Dog Inflicts Multiple Attacks,"Biden's German Shepherd, Commander, seems to be adding 'Secret Service chomper' to his resume. Keep your friends close ...",Right
The Next News Network,From NBA Star to Potential Senator: Enes Kanter Freedom&#39;s Political Ambitions,Keep Your Family Fed Through Shortages http://preparewithgary.com Get $200 Off A 3-Month Emergency Supply ^^^ Former NBA ...,Right
